{
  "schema_version": "0.1.0",
  "dossier_id": "dossier-toy-missing-risk",
  "instance_id": "toy-risk-2",
  "repository": "toy-owner/risk-repo",
  "pr_url": "https://github.com/toy-owner/risk-repo/pull/2",
  "source_agent": "ClaudeCode",
  "created_at": "2026-06-01T12:00:00Z",
  "dossier_created_at": "2026-06-02T00:00:00Z",
  "evidence": {
    "intent": {"present": true, "quality": 2, "claim": "Fix empty-cache lookups returning 500.", "grounding": [{"artifact_type": "pr_body", "reference": "summary"}]},
    "requirement_traceability": {"present": true, "quality": 2, "claim": "Maps behavior to issue #41.", "grounding": [{"artifact_type": "issue", "reference": "#41"}]},
    "test_rationale": {"present": true, "quality": 2, "claim": "Adds targeted regression test.", "grounding": [{"artifact_type": "test", "reference": "tests/cache/test_lookup.py"}]},
    "regression_safety": {"present": true, "quality": 1, "claim": "Reports targeted pytest only.", "grounding": [{"artifact_type": "ci", "reference": "pytest"}]},
    "risk_analysis": {"present": false, "quality": 0, "claim": "", "grounding": [], "notes": "No risk discussion."},
    "scope_justification": {"present": true, "quality": 1, "claim": "Mentions only cache files changed.", "grounding": [{"artifact_type": "changed_files", "reference": "files"}]},
    "change_summary": {"present": true, "quality": 2, "claim": "Summarizes lookup behavior and tests.", "grounding": [{"artifact_type": "diff_summary", "reference": "summary"}]},
    "agent_trace": {"present": true, "quality": 1, "claim": "Trace lists inspected file and one test.", "grounding": [{"artifact_type": "agent_trace", "reference": "trace"}]},
    "limitations": {"present": true, "quality": 1, "claim": "Notes no full regression matrix.", "grounding": [{"artifact_type": "pr_body", "reference": "limitations"}]},
    "reviewer_actionability": {"present": true, "quality": 1, "claim": "Asks reviewer to verify cache semantics.", "grounding": [{"artifact_type": "pr_body", "reference": "review notes"}]},
    "ownership_handoff": {"present": true, "quality": 1, "claim": "Names rollback to previous cache handler.", "grounding": [{"artifact_type": "pr_body", "reference": "handoff"}]}
  },
  "limitations": ["Toy dossier with missing risk analysis."],
  "metadata": {"toy": true, "corpus_role": "missing_risk"}
}
