{
  "schema_version": "0.1.0",
  "dossier_id": "dossier-toy-complete",
  "instance_id": "toy-complete-1",
  "repository": "toy-owner/complete-repo",
  "pr_url": "https://github.com/toy-owner/complete-repo/pull/1",
  "source_agent": "Codex",
  "created_at": "2026-06-01T12:00:00Z",
  "dossier_created_at": "2026-06-02T00:00:00Z",
  "evidence": {
    "intent": {"present": true, "quality": 2, "claim": "Fix a documented cache miss bug.", "grounding": [{"artifact_type": "pr_body", "reference": "summary"}]},
    "requirement_traceability": {"present": true, "quality": 2, "claim": "Maps the behavior to issue #101.", "grounding": [{"artifact_type": "issue", "reference": "#101"}]},
    "test_rationale": {"present": true, "quality": 2, "claim": "Adds targeted and boundary tests for the cache miss.", "grounding": [{"artifact_type": "test", "reference": "tests/test_cache.py"}]},
    "regression_safety": {"present": true, "quality": 2, "claim": "Reports unit and integration test coverage.", "grounding": [{"artifact_type": "ci", "reference": "unit-and-integration"}]},
    "risk_analysis": {"present": true, "quality": 2, "claim": "Identifies stale-cache and error-code risks.", "grounding": [{"artifact_type": "pr_body", "reference": "risk section"}]},
    "scope_justification": {"present": true, "quality": 2, "claim": "Explains why only cache lookup files changed.", "grounding": [{"artifact_type": "changed_files", "reference": "files"}]},
    "change_summary": {"present": true, "quality": 2, "claim": "Summarizes the behavior change and tests.", "grounding": [{"artifact_type": "diff_summary", "reference": "summary"}]},
    "agent_trace": {"present": true, "quality": 2, "claim": "Lists files inspected and commands run.", "grounding": [{"artifact_type": "agent_trace", "reference": "trace"}]},
    "limitations": {"present": true, "quality": 2, "claim": "States that load testing was not run.", "grounding": [{"artifact_type": "pr_body", "reference": "limitations"}]},
    "reviewer_actionability": {"present": true, "quality": 2, "claim": "Names the cache semantics a reviewer should verify.", "grounding": [{"artifact_type": "pr_body", "reference": "review notes"}]},
    "ownership_handoff": {"present": true, "quality": 2, "claim": "Provides rollback and follow-up owner.", "grounding": [{"artifact_type": "pr_body", "reference": "handoff"}]}
  },
  "limitations": ["Toy complete dossier."],
  "metadata": {"toy": true, "corpus_role": "complete"}
}
